#,Song,Artist,Popularity,BPM,Genres,Parent Genres,Album,Album Date,Time,Dance,Energy,Acoustic,Instrumental,Happy,Speech,Live,Loud (Db),Key,Time Signature,Added At,Spotify Track Id,Album Label,Camelot,ISRC
1,"When You Say My Name","Chandler Leighton",63,93,"alt z, dark r&b, la pop","Pop, R&B","When You Say My Name",2022-03-10,02:28,79,54,4,0,58,0,10,-8,C♯/D♭ Major,4,2023-10-30,3a8b6uo4vnQSJroGhaNhgG,"Boom.Records",3B,QM24S2200862
2,"Cruel","Oli Fox",27,96,"uk pop","Pop","Cruel",2018-07-13,03:11,84,45,2,0,62,0,10,-8,A Major,4,2023-10-30,7MaRmvRgXtScvGuMj7e7dE,"Universal-Island Records Ltd.",11B,GBUM71801234
3,"Dance Again","Selena Gomez",47,112,"pop, post-teen pop","Pop","Rare",2020-01-10,02:50,78,55,4,0,46,0,20,-7,C♯/D♭ Minor,4,2023-10-30,5sK3o66yupTNIK6gWgzGjf,"Interscope Records",12A,USUM71923482
4,"Touch - Hermitude Remix","Big Wild,Hermitude",28,106,"vapor soul, australian dance, australian indie, downtempo, escape room","Electronic, Pop, R&B","Touch (Hermitude Remix)",2020-07-09,02:48,82,55,18,1,47,0,0,-9,E Minor,4,2023-10-30,18nSOp3LMuv0QUExig5YrL,"Counter Records",9A,GBCFB2000343
5,"Butterflies","James TW",44,100,"british singer-songwriter, uk pop","Folk/Acoustic, Pop","Heartbeat Changes",2022-04-29,03:17,71,66,23,0,51,10,10,-7,C Minor,4,2023-10-30,3HPS8Nh23hatP7iZ3E7qEz,"Island Records",5A,USUM72102562
6,"September Song","JP Cooper",64,96,"uk pop","Pop","Raised Under Grey Skies (Deluxe)",2017-10-06,03:40,61,62,5,0,37,0,0,-7,C Minor,4,2023-10-30,0zbzrhfVS9S2TszW3wLQZ7,"Universal-Island Records Ltd.",5A,GBUM71604513
7,"Move On.","Indy Angel",25,90,"","","Move On.",2020-08-14,03:12,61,57,56,0,54,0,10,-7,A Major,4,2023-10-30,1FEqnQz42e1GPunYrC7231,"Marshmallow Pavement",11B,AUUGC1701066
8,"What Good Is Love","Paul Rey",21,94,"swedish pop","Pop","What Good Is Love",2017-09-08,03:04,56,58,5,0,40,0,10,-6,F#/G♭ Minor,4,2023-10-30,6NruwXfwah8iQHOmawEyCW,"WM Sweden",11A,SEYQE1700103
9,"Friends","Aura Dione,Rock Mafia",33,94,"danish pop, scandipop, ","Pop","Before The Dinosaurs",2011-00-00,03:43,69,93,2,0,73,10,0,-6,G Major,4,2023-10-30,5Hw98Jnc3teIR42EoEMM93,"Magic Records",9B,DEUM71102911
10,"South of the Border (feat. Camila Cabello & Cardi B)","Ed Sheeran,Camila Cabello,Cardi B",70,98,"pop, singer-songwriter pop, uk pop, dance pop, rap","Pop, Hip Hop","No.6 Collaborations Project",2019-07-12,03:24,86,62,15,0,67,0,0,-6,A Minor,4,2023-10-30,4vUmTMuQqjdnvlZmAH61Qk,"Atlantic Records UK",8A,GBAHS1900714
11,"Human Touch","Betty Who",35,103,"australian dance, dance pop, electropop, metropopolis","Electronic, Pop","The Valley",2017-03-24,03:33,72,72,6,0,66,0,0,-4,B Minor,4,2023-10-30,4CvLP28DM6r7h9mEa55FBb,"RCA Records Label",10A,USRC11602586
12,"Young & Stupid","Travis Mills,T.I.",32,107,"pop rap, atl hip hop, dirty south rap, gangster rap, hip hop, rap, southern hip hop, trap","Hip Hop","Young & Stupid",2015-07-24,03:06,78,79,13,0,80,10,30,-4,C♯/D♭ Minor,4,2023-10-30,26a1ih91NiFLHgJo4Tk2Dw,"Lava Music/Republic Records",12A,USUM71509991
13,"Confetti","Charlotte Cardin",56,111,"canadian pop, indie quebecois","Pop, Blues","99 Nights",2023-08-25,03:03,80,50,54,0,45,10,40,-6,D#/E♭ Major,4,2023-10-30,73m3OYU7lG7irNbFjNipwF,"Atlantic Records",5B,USAT22302690
14,"One Dance","Drake,Wizkid,Kyla",85,104,"canadian hip hop, canadian pop, hip hop, pop rap, rap, afrobeats, afropop, azonto, nigerian hip hop, nigerian pop, uk funky","R&B, Pop, World/Traditional, Hip Hop, Electronic","Views",2016-05-06,02:53,79,63,1,0,37,0,30,-6,C♯/D♭ Major,4,2023-10-30,1zi7xx7UVEFkmKfv06H8x0,"Cash Money Records/Young Money Ent./Universal Rec.",3B,USCM51600028
15,"Wild Thoughts (feat. Rihanna & Bryson Tiller)","DJ Khaled,Rihanna,Bryson Tiller",74,98,"hip hop, miami hip hop, pop rap, rap, barbadian pop, pop, urban contemporary, kentucky hip hop, r&b","Pop, Hip Hop, R&B","Grateful",2017-06-22,03:24,67,67,3,0,63,0,10,-3,C Minor,4,2023-10-30,1OAh8uOEOvTDqkKFsKksCi,"Epic/We The Best",5A,USSM11705088
16,"The Next Episode","Dr. Dre,Snoop Dogg",80,95,"g funk, gangster rap, hip hop, rap, west coast rap, pop rap","Hip Hop","2001",1999-11-16,02:41,92,91,3,0,31,20,0,-2,A#/B♭ Minor,4,2023-10-30,4LwU4Vp6od3Sb08CsP99GC,"Aftermath",3A,USIR19915078
17,"Na Na","Trey Songz",62,97,"dance pop, r&b, southern hip hop, trap, urban contemporary","Pop, R&B, Hip Hop","Trigga Reloaded",2015-06-23,03:51,67,48,33,0,24,0,10,-6,A Minor,4,2023-10-30,5LIleJbUUgtvYnBW9wfY1W,"Songbook/Atlantic",8A,USAT21304769
18,"Hush","The Marías",58,93,"bedroom pop, la indie","Pop","CINEMA",2021-06-25,03:01,85,43,7,18,68,0,0,-7,F Minor,4,2023-10-30,4zXZ5Mq2L6jnsOsTssgRh8,"Nice Life/Atlantic",4A,USAT22100692
19,"Bad Girl","Sickick",36,99,"bass trap","Hip Hop","Bad Girl",2020-12-03,02:50,84,51,5,0,53,0,10,-9,A#/B♭ Major,4,2023-10-30,4zIhXWhL9yNENSAwXrkcsF,"SICK UNIVERSE CORP",6B,QZNWU2083282
20,"I Don't Wanna Be Friends","Kiiara",19,103,"alt z, electropop","Pop","I Don't Wanna Be Friends",2018-10-25,02:04,85,68,16,0,39,0,0,-5,B Minor,4,2023-10-30,0vrn2hJZCpsfZgXr7nNHji,"Atlantic Records",10A,USAT21811503
21,"Done for Me (feat. Kehlani)","Charlie Puth,Kehlani",65,112,"pop, viral pop, r&b, rap","Pop, R&B, Hip Hop","Voicenotes",2018-05-11,03:00,86,63,19,0,70,0,0,-4,F#/G♭ Minor,4,2023-10-30,1lsBTdE6MGsKeZCD6llNu7,"Artist Partner",11A,USAT21702279
22,"Ferris Wheel","Sylvan Esso",46,102,"art pop, chamber pop, etherpop, indie pop, indie rock, indietronica, shimmer pop","Pop, Rock","Free Love",2020-09-25,02:57,84,74,6,0,45,0,10,-5,A Minor,4,2023-10-30,0yiJNNm39cp1T7RnXOMVLX,"Loma Vista Recordings",8A,USC4R2003469
23,"Wait","NoMBe",58,98,"vapor soul","R&B","They Might've Even Loved Me",2018-03-23,03:34,76,46,22,2,19,0,10,-8,E Minor,4,2023-10-30,70OhoWldJxT2YAyi5eE8QZ,"TH3RD BRAIN",9A,TCACW1758501
24,"Tricky","Shoffy,Sabrina Carpenter",38,90,"chill pop, la pop, pop","Pop","Flash",2020-03-13,02:31,83,47,59,0,87,20,10,-7,A Minor,4,2023-10-30,5xXGzRBNC2xUZIjYq11cAN,"Otherground Records",8A,QZC5P1800134
25,"Whataya Want from Me","Adam Lambert",53,186,"dance pop, idol, pop, post-teen pop","Pop","For Your Entertainment",2009-00-00,03:47,44,67,1,0,46,0,0,-5,B Minor,4,2023-10-30,0zv9bOC2NSMd3Fw2HgM5Xn,"RCA Records Label",10A,GBCTA0900344
26,"Sex in the City","Cody Kahmar",5,97,"","","Sex in the City",2013-02-14,04:08,74,70,3,0,56,0,30,-7,A Minor,4,2023-10-30,7c3KBonIkNGqPtdaMQRQju,"My World Entertainment, LLC",8A,QMJTP1200005
27,"Feelings","Lauv",65,103,"pop","Pop","~how i'm feeling~",2020-03-06,03:09,70,39,6,0,24,0,0,-9,A Major,4,2023-10-30,6r3duEAfFTH83DuoywkG20,"Lauv",11B,GBKPL1966988
28,"Something About You (with Rudimental)","Elderbrook,Rudimental",47,107,"uk dance, pop dance, uk funky","Electronic","Something About You (with Rudimental)",2019-08-09,03:23,77,61,56,0,66,10,10,-6,F#/G♭ Minor,4,2023-10-30,3hYdai5p5sQ3vAmHQ6uaK6,"Parlophone UK",11A,GBAYE1900696
29,"Working For The Weekend (feat. bbno$)","MAX,bbno$",37,101,"singer-songwriter pop, teen pop, viral pop, canadian hip hop, dark trap, meme rap","Hip Hop, Pop","Working For The Weekend (feat. bbno$)",2020-09-04,02:45,86,57,22,0,76,20,10,-6,B Minor,4,2023-10-30,3hFJCuaWDiHhgEtcXDrRjW,"Colour Vision Records/Sony Music Entertainment",10A,USQX92000868
30,"Thong Song","Amber Mark",38,98,"alternative r&b, indie soul, nyc pop","R&B, Pop","Thong Song",2020-08-21,03:31,68,42,31,0,29,10,10,-10,F#/G♭ Minor,4,2023-10-30,52dyJ3VDZFuvTKH95UGwa2,"EMI",11A,GBUM72002659
31,"Give a Little (feat. Naila)","Ash,Naila",50,93,"arab electronic, ","Electronic","Give a Little (feat. Naila)",2018-01-30,03:54,66,58,46,0,76,0,10,-8,D#/E♭ Minor,4,2023-10-30,5TjdmkuqqjkyIIVuDqyFPE,"Ash",2A,QZARB1804671
32,"Underdog","Alicia Keys",59,90,"neo soul, pop, r&b","R&B, Pop","ALICIA",2020-12-18,03:24,66,73,54,0,28,0,10,-5,C Minor,4,2023-10-30,7FsAFw1oZeTJUZmIzSh0cg,"RCA Records Label",5A,USRC11903811
33,"Locked Away (feat. Adam Levine)","R. City,Adam Levine",76,118,"reggae fusion, virgin islands reggae, deep talent show","Country, Pop","What Dreams Are Made Of",2015-10-09,03:47,51,67,30,0,55,0,0,-6,C♯/D♭ Major,5,2023-10-30,7x5xYW5W42OGPAdHUyyguy,"Kemosabe Records/RCA Records",3B,USRC11501369
34,"Brooklyn","Patrick Droney",43,100,"nashville singer-songwriter","Country","Patrick Droney",2019-04-12,03:47,63,59,60,1,51,0,60,-9,B Major,4,2023-10-30,0gvGXQK14CIGLssQhruY8E,"Warner Records",1B,GBKPL1813868
35,"Dancing With A Stranger (with Normani)","Sam Smith,Normani",69,103,"pop, uk pop, r&b","Pop, R&B","Dancing With A Stranger (with Normani)",2019-01-11,02:51,74,52,45,0,35,0,20,-8,G#/A♭ Major,4,2023-10-30,6Qs4SXO9dwPj5GKvVOv8Ki,"PLG - Capitol",4B,GBUM71807386
36,"Lavender Haze","Taylor Swift",74,97,"pop","Pop","Midnights",2022-10-21,03:22,74,45,23,0,10,0,10,-11,G Minor,4,2023-10-30,5jQI2r1RdgtuT8S3iG8zFC,"Taylor Swift",6A,USUG12205734
37,"Lose Control / Let Me Down","Keri Hilson",37,91,"dance pop, hip pop, r&b, urban contemporary","Pop, R&B, Hip Hop","No Boys Allowed (All International Partners Deluxe Version)",2010-01-01,04:49,68,73,53,0,45,0,10,-4,F Major,4,2023-10-30,4ymZUCAf5qTenKxeOfRSB5,"Mosley / Interscope",7B,USUM71028781
38,"Clothes Off - Single Version","Ria Mae",31,95,"canadian pop","Pop","Ria Mae",2014-00-00,03:23,64,72,14,0,60,10,30,-7,B Minor,4,2023-10-30,798pGLPSM0Sxy94AESVd6s,"Sony Music Canada",10A,CA5LP1501012
39,"nuh uh","Jades Goudreault",51,98,"la pop","Pop","Motel 6 (Bonus Track)",2021-01-06,02:31,93,59,5,0,57,10,0,-3,C♯/D♭ Major,4,2023-10-30,2tigH2DP65aAzAlyAFNoRZ,"Jades Goudreault",3B,QZNWY2019923
40,"Bang Bang","Fedde Le Grand,22Bullets",36,103,"dutch house, edm, electro house, house, pop dance, progressive electro house, progressive house, sky room, slap house","Electronic","Bang Bang",2021-01-22,02:23,76,65,3,2,36,0,0,-6,C♯/D♭ Major,4,2023-10-30,50v0Mz0cnt4FY0LFPi5SGV,"Chérie Amour Productions",3B,FR9W12035689
41,"Mad Love","Mabel",60,198,"pop, uk pop","Pop","High Expectations",2019-08-02,02:49,62,80,66,0,61,20,10,-3,C Minor,4,2023-10-30,6ImEBuxsbuTowuHmg3Z2FO,"Polydor Records",5A,GBUM71902039